{
  "schema_version": "metaboagent.phase_flow.v1",
  "run_id": "liver_cancer_example_20260818",
  "study": {
    "disease": "Liver cancer",
    "study_id": "example_study_id",
    "intended_use": "Research-use-only biomarker panel development",
    "outcome": "Case-control disease classification",
    "specimen": "serum_or_plasma_not_archived",
    "platform": "metabolomics_platform_not_archived"
  },
  "artifacts": [
    {"id": "raw_matrix", "kind": "raw_matrix", "path": "input/raw_matrix.csv", "sha256": null, "status": "complete", "scope": "raw", "produced_by": null},
    {"id": "split_manifest", "kind": "split_manifest", "path": "input/split_manifest.json", "sha256": null, "status": "complete", "scope": "mixed", "produced_by": null},
    {"id": "phase0_literature", "kind": "json", "path": "phase0/phase0_literature.json", "sha256": null, "status": "complete", "scope": "raw", "produced_by": "phase0_literature"},
    {"id": "phase0_priors", "kind": "json", "path": "phase0/phase0_output_latest.json", "sha256": null, "status": "complete", "scope": "raw", "produced_by": "phase0_literature"},
    {"id": "phase1_preprocessor", "kind": "json", "path": "phase1/preprocessing_report.json", "sha256": null, "status": "complete", "scope": "train_only", "produced_by": "phase1_preprocessing"},
    {"id": "candidate_matrix", "kind": "table", "path": "phase1/candidate_matrix.csv", "sha256": null, "status": "complete", "scope": "mixed", "produced_by": "phase1_preprocessing"},
    {"id": "stability_summary", "kind": "json", "path": "phase1/stability_selection_summary.json", "sha256": null, "status": "complete", "scope": "train_only", "produced_by": "phase1_selection"},
    {"id": "winner_panel", "kind": "table", "path": "phase2/winner_panel.json", "sha256": null, "status": "complete", "scope": "development_cv", "produced_by": "phase2_model"},
    {"id": "model_spec", "kind": "model", "path": "phase2/model_card.json", "sha256": null, "status": "partial", "scope": "development_cv", "produced_by": "phase2_model", "notes": "Some historical runs may not archive all hyperparameters."},
    {"id": "oof_predictions", "kind": "prediction", "path": "phase3/evaluation_predictions_oof.csv", "sha256": null, "status": "complete", "scope": "development_cv", "produced_by": "phase3_validation"},
    {"id": "holdout_predictions", "kind": "prediction", "path": "phase3/evaluation_predictions_holdout.csv", "sha256": null, "status": "complete", "scope": "internal_holdout", "produced_by": "phase3_validation"},
    {"id": "performance_metrics", "kind": "metric", "path": "phase3/metric_registry.json", "sha256": null, "status": "complete", "scope": "mixed", "produced_by": "phase3_validation"},
    {"id": "figure_registry", "kind": "json", "path": "phase3/figure_manifest.json", "sha256": null, "status": "complete", "scope": "mixed", "produced_by": "phase3_validation"},
    {"id": "phase_flow_manifest", "kind": "json", "path": "phase4/phase_flow_manifest.json", "sha256": null, "status": "complete", "scope": "mixed", "produced_by": "phase4_report"},
    {"id": "report_context", "kind": "json", "path": "phase4/report_context.json", "sha256": null, "status": "complete", "scope": "mixed", "produced_by": "phase4_report"},
    {"id": "report_html", "kind": "report", "path": "phase4/report.html", "sha256": null, "status": "planned", "scope": "mixed", "produced_by": "phase4_report"}
  ],
  "nodes": [
    {
      "id": "phase0_literature",
      "phase": "phase0",
      "label": "Literature, disease knowledge and prior evidence",
      "inputs": [],
      "outputs": ["phase0_literature", "phase0_priors"],
      "sample_scope": "raw",
      "fit_scope": "none",
      "status": "complete",
      "n_samples_in": null,
      "n_samples_out": null,
      "n_features_in": null,
      "n_features_out": null,
      "decision_effect": "changes_candidates",
      "evidence_boundary": "Literature-supported priors are not independent biomarker validation."
    },
    {
      "id": "phase1_preprocessing",
      "phase": "phase1",
      "label": "QC, preprocessing and candidate matrix construction",
      "inputs": ["raw_matrix", "split_manifest"],
      "outputs": ["phase1_preprocessor", "candidate_matrix"],
      "sample_scope": "mixed",
      "fit_scope": "within_training_fold",
      "status": "complete",
      "n_samples_in": 438,
      "n_samples_out": 438,
      "n_features_in": 15,
      "n_features_out": 15,
      "decision_effect": "changes_candidates",
      "evidence_boundary": "Fit statistics must be estimated from training data only."
    },
    {
      "id": "phase1_selection",
      "phase": "phase1",
      "label": "Train-only stability selection",
      "inputs": ["candidate_matrix", "phase0_priors"],
      "outputs": ["stability_summary"],
      "sample_scope": "train_only",
      "fit_scope": "within_training_fold",
      "status": "complete",
      "n_samples_in": 350,
      "n_samples_out": 350,
      "n_features_in": 15,
      "n_features_out": 9,
      "decision_effect": "changes_candidates",
      "evidence_boundary": "Selection frequency is candidate-selection stability, not final-model stability."
    },
    {
      "id": "phase2_model",
      "phase": "phase2",
      "label": "Multi-objective panel search and model development",
      "inputs": ["candidate_matrix", "stability_summary", "split_manifest"],
      "outputs": ["winner_panel", "model_spec"],
      "sample_scope": "development_cv",
      "fit_scope": "within_training_fold",
      "status": "complete",
      "n_samples_in": 350,
      "n_samples_out": 350,
      "n_features_in": 9,
      "n_features_out": 5,
      "decision_effect": "changes_model",
      "evidence_boundary": "The selected panel remains development evidence until independently validated."
    },
    {
      "id": "phase3_validation",
      "phase": "phase3",
      "label": "Prediction, uncertainty, clinical utility and interpretation figures",
      "inputs": ["winner_panel", "model_spec", "split_manifest"],
      "outputs": ["oof_predictions", "holdout_predictions", "performance_metrics", "figure_registry"],
      "sample_scope": "mixed",
      "fit_scope": "mixed",
      "status": "complete",
      "n_samples_in": 438,
      "n_samples_out": 438,
      "n_features_in": 5,
      "n_features_out": 5,
      "decision_effect": "descriptive_only",
      "evidence_boundary": "Internal CV and internal holdout do not establish external transportability."
    },
    {
      "id": "phase4_report",
      "phase": "phase4",
      "label": "Evidence contract, narrative, inline figures and delivery package",
      "inputs": ["phase0_literature", "phase0_priors", "phase1_preprocessor", "candidate_matrix", "stability_summary", "winner_panel", "model_spec", "oof_predictions", "holdout_predictions", "performance_metrics", "figure_registry", "phase_flow_manifest"],
      "outputs": ["report_context", "report_html"],
      "sample_scope": "mixed",
      "fit_scope": "none",
      "status": "planned",
      "n_samples_in": 438,
      "n_samples_out": 438,
      "n_features_in": 5,
      "n_features_out": 5,
      "decision_effect": "creates_report",
      "evidence_boundary": "Phase 4 must not recompute or alter scientific decisions."
    }
  ],
  "edges": [
    {"from": "phase0_literature", "to": "phase1_selection", "artifact_id": "phase0_priors", "label": "biological priors"},
    {"from": "phase1_preprocessing", "to": "phase1_selection", "artifact_id": "candidate_matrix", "label": "candidate matrix"},
    {"from": "phase1_selection", "to": "phase2_model", "artifact_id": "stability_summary", "label": "stable candidate evidence"},
    {"from": "phase2_model", "to": "phase3_validation", "artifact_id": "winner_panel", "label": "final panel"},
    {"from": "phase2_model", "to": "phase3_validation", "artifact_id": "model_spec", "label": "selected model"},
    {"from": "phase3_validation", "to": "phase4_report", "artifact_id": "performance_metrics", "label": "canonical metrics"},
    {"from": "phase3_validation", "to": "phase4_report", "artifact_id": "figure_registry", "label": "registered figures"},
    {"from": "phase4_report", "to": "phase4_report", "artifact_id": "phase_flow_manifest", "label": "self-describing flow contract"}
  ],
  "policy": {
    "phase_order": ["phase0", "phase1", "phase2", "phase3", "phase4"],
    "external_validation_rule": "Only an explicitly declared external cohort may be labelled external.",
    "missing_artifact_rule": "Missing evidence is rendered as not_archived and cannot be inferred."
  }
}
